Call Center Agent ID,Call Center Agent Name,Transcript Text,Transcript ID,QA Total Score,Q1.Greeting,Q1.Greeting Evidence,Q1.Greeting Reason,Q2.VerifyInformation,Q2.VerifyInformation Evidence,Q2.VerifyInformation Reason,Q3.AddressUpdate,Q3.AddressUpdate Evidence,Q3.AddressUpdate Reason,Q4.PhoneNumberUpdate,Q4.PhoneNumberUpdate Evidence,Q4.PhoneNumberUpdate Reason,Q5.EmailUpdate,Q5.EmailUpdate Evidence,Q5.EmailUpdate Reason,Q6.GivingInformation,Q6.GivingInformation Evidence,Q6.GivingInformation Reason,Q7.ApplicationPromotion,Q7.ApplicationPromotion Evidence,Q7.ApplicationPromotion Reason,Q8.AcknowledgeAdditionalRequest,Q8.AcknowledgeAdditionalRequest Evidence,Q8.AcknowledgeAdditionalRequest Reason,Q9.Ending,Q9.Ending Evidence,Q9.Ending Reason,QoS Label,QoS Reason,QoS Keywords Found,QoS Issue Type,Sentiment Score,Sentiment Label,Sentiment Reason,Sentiment Positive Keywords,Sentiment Negative Keywords
AMC-L-CC-027,Alexander Martinez,"Alexander Martinez: Good afternoon.\nAlexander Martinez: Thank you for calling Automaticine.\nCustomer: I'm interested in upgrading my current plan to get more benefits, what options do I have?\nAlexander Martinez: May I have your name please?\nCustomer: My name is Nattapong Suksawat.\nAlexander Martinez: May I also confirm the name registered on this account?\nCustomer: Yes, it's under Nattapong Suksawat.\nAlexander Martinez: May I confirm your current address is 168 Srinakarin Rd., Sai Mai, Bangkok 10220?\nCustomer: Yes, that is correct.\nAlexander Martinez: May I confirm your current phone number ending in 3258?\nCustomer: Yes, that's right.\nAlexander Martinez: May I confirm your e-mail address is nattapong.s@outlook.com?\nCustomer: Yes, that's the same.\nAlexander Martinez: To directly answer your question, yes, the upgrade can be applied immediately and will be reflected on your next billing cycle.\nAlexander Martinez: I will process the upgrade request now and send you the updated terms by email.\nAlexander Martinez: Your new plan benefits will be active starting from today.\nAlexander Martinez: I understand you may also use our mobile application for comparing all available plans side by side.\nAlexander Martinez: Is there anything else I can help you with today?\nCustomer: No, that's all, thank you.\nAlexander Martinez: Have a good day.",AMC-L-CC-02720260219165806891,77.0,5.0,"""Good afternoon. Thank you for calling Automaticine."" (+2.5 pts) (+2.5 pts)","The agent met 2 of 4 greeting sub-criteria for the greeting: professional greeting (+2.5), company name mention (+2.5), self-introduction by name not met (0), offer of assistance not met (0).",10.0,"""May I have your name please? My name is Nattapong Suksawat."" (+5 pts) (+5 pts)","The agent met 2 of 3 verification sub-criteria for contact verification: verified contact person name (+5), verified registered member / company name on account (+5), verified caller's relationship to the registered member not met (0).",10.0,"""May I confirm your current address is 168 Srinakarin Rd., Sai Mai, Bangkok 10220?"" (+10 pts)","The agent reviewed/updated the address with the customer and obtained confirmation, so this criterion was fully met (+10). This category is all-or-nothing and qualifies in full when review or update occurs.",10.0,"""May I confirm your current phone number ending in 3258?"" (+10 pts)","The agent reviewed/updated the phone number with the customer and obtained confirmation, so this criterion was fully met (+10). This category is all-or-nothing and qualifies in full when review or update occurs.",10.0,"""May I confirm your e-mail address is nattapong.s@outlook.com?"" (+10 pts)","The agent reviewed/updated the email address with the customer and obtained confirmation, so this criterion was fully met (+10). This category is all-or-nothing and qualifies in full when review or update occurs.",15.0,"""To directly answer your question, yes, the upgrade can be applied immediately and will be reflected on your next billing cycle. I will process the upgrade request now and send you the updated terms by email. Your new plan benefits will be active starting from today."" (+5 pts) (+5 pts) (+5 pts)","The agent met 3 of 4 information-giving sub-criteria for issue resolution: provided relevant account/issue information not met (0), answered the customer's specific concern (+5), communicated next steps clearly (+5), gave a clear resolution (+5).",7.0,"""I understand you may also use our mobile application for comparing all available plans side by side."" (+6 pts) (+1 pt)","The agent met 2 of 3 application-promotion sub-criteria for the application promotion: mentioned/recommended the mobile application (+6), recommendation relevant to customer's need (+1), explained a concrete benefit of the application not met (0).",5.0,"""Is there anything else I can help you with today?"" (+5 pts)",The agent met the additional-request criterion for closing acknowledgement: offered additional assistance (+5).,5.0,"""Have a good day."" (+5 pts)","The agent met 1 of 2 ending sub-criteria for the call ending: thanked the customer not met (0), gave a professional closing statement (+5).",Normal,"The conversation involves plan upgrade inquiry. Based on the nature of the issue, this maps to a Normal classification.","awesome, thank you so much, sounds great, perfect, plan upgrade inquiry",plan upgrade inquiry,10.0,Happy,Happy,"awesome, thank you so much, sounds great, perfect",none noted
AMC-L-CC-042,Noah Walker,"Noah Walker: Thank you for calling Automaticine.\nNoah Walker: How may I assist you today?\nCustomer: Hi, I recently moved to a new home and I need to update my address on file.\nNoah Walker: May I have your name please?\nCustomer: My name is Thanawat Watcharaporn.\nNoah Walker: May I confirm your current address is 160 Bangna-Trad Rd., Lat Phrao, Bangkok 10230?\nCustomer: Actually, please update it, I moved to 160 Bangna-Trad Rd., Lat Phrao, Bangkok 10230.\nNoah Walker: May I confirm your current phone number ending in 8835?\nCustomer: Yes, that's right.\nNoah Walker: May I confirm your e-mail address is thanawat.w@hotmail.com?\nCustomer: Yes, that's the same.\nNoah Walker: The change will take effect immediately in our system.\nNoah Walker: I understand you may also use our mobile application for updating your address yourself anytime without calling in. That way, future moves can be updated in just a few taps.\nNoah Walker: Is there anything else I can help you with today?\nCustomer: No, that's all, thank you.\nNoah Walker: Thank you for calling Automaticine.\nNoah Walker: Have a good day.",AMC-L-CC-04220260206183035169,70.0,5.0,"""Thank you for calling Automaticine. How may I assist you today?"" (+2.5 pts) (+2.5 pts)","The agent met 2 of 4 greeting sub-criteria for the greeting: professional greeting not met (0), company name mention (+2.5), self-introduction by name not met (0), offer of assistance (+2.5).",5.0,"""May I have your name please? My name is Thanawat Watcharaporn."" (+5 pts)","The agent met 1 of 3 verification sub-criteria for contact verification: verified contact person name (+5), verified registered member / company name on account not met (0), verified caller's relationship to the registered member not met (0).",10.0,"""May I confirm your current address is 160 Bangna-Trad Rd., Lat Phrao, Bangkok 10230?"" (+10 pts)","The agent reviewed/updated the address with the customer and obtained confirmation, so this criterion was fully met (+10). This category is all-or-nothing and qualifies in full when review or update occurs.",10.0,"""May I confirm your current phone number ending in 8835?"" (+10 pts)","The agent reviewed/updated the phone number with the customer and obtained confirmation, so this criterion was fully met (+10). This category is all-or-nothing and qualifies in full when review or update occurs.",10.0,"""May I confirm your e-mail address is thanawat.w@hotmail.com?"" (+10 pts)","The agent reviewed/updated the email address with the customer and obtained confirmation, so this criterion was fully met (+10). This category is all-or-nothing and qualifies in full when review or update occurs.",5.0,"""The change will take effect immediately in our system."" (+5 pts)","The agent met 1 of 4 information-giving sub-criteria for issue resolution: provided relevant account/issue information not met (0), answered the customer's specific concern not met (0), communicated next steps clearly (+5), gave a clear resolution not met (0).",10.0,"""I understand you may also use our mobile application for updating your address yourself anytime without calling in. That way, future moves can be updated in just a few taps."" (+6 pts) (+1 pt) (+3 pts)","The agent met all 3 application-promotion sub-criteria for the application promotion: mentioned/recommended the mobile application (+6), recommendation relevant to customer's need (+1), explained a concrete benefit of the application (+3).",5.0,"""Is there anything else I can help you with today?"" (+5 pts)",The agent met the additional-request criterion for closing acknowledgement: offered additional assistance (+5).,10.0,"""Thank you for calling Automaticine. Have a good day."" (+5 pts) (+5 pts)","The agent met both ending sub-criteria for the call ending: thanked the customer (+5), gave a professional closing statement (+5).",Normal,"The conversation involves routine address update request. Based on the nature of the issue, this maps to a Normal classification.","great, thank you, perfect, appreciate it, routine address update request",routine address update request,5.0,Satisfied,Satisfied,"great, thank you, perfect, appreciate it",none noted
AMC-L-CC-053,Mason King,"Mason King: Good afternoon.\nMason King: Thank you for calling Automaticine.\nMason King: My name is Mason.\nMason King: How may I assist you today?\nCustomer: I want to cancel my membership, I'm not getting enough value from this service anymore.\nMason King: I'm sorry to hear that, I understand your concern and I'll do my best to help.\nMason King: May I have your name please?\nCustomer: My name is Chatchai Intharak.\nMason King: May I also confirm the name registered on this account?\nCustomer: Yes, it's under Chatchai Intharak.\nMason King: May I confirm your current phone number ending in 7749?\nCustomer: Yes, that's right.\nMason King: May I confirm your e-mail address is chatchai.i@ptt-corp.com?\nCustomer: Yes, that's the same.\nMason King: I'm sorry to hear that you're considering leaving, may I ask what specifically has not met your expectations?\nMason King: Based on what you've shared, there is actually a lower-tier plan that may suit your usage better and could be a good alternative to full cancellation.\nMason King: If you would still like to proceed with cancellation, I can process that request and it will take effect at the end of your current billing cycle.\nMason King: You will receive a confirmation email once the cancellation has been finalized.\nCustomer: I just hope this actually gets resolved this time.\nMason King: I understand you may also use our mobile application for reviewing your usage and plan options before deciding to cancel. That way, you could compare plans yourself and possibly find a better fit.\nMason King: Thank you for calling Automaticine.\nMason King: Have a good day.",AMC-L-CC-05320260228160846957,80.0,10.0,"""Good afternoon. Thank you for calling Automaticine. My name is Mason. How may I assist you today?"" (+2.5 pts) (+2.5 pts) (+2.5 pts) (+2.5 pts)","The agent met all 4 greeting sub-criteria for the greeting: professional greeting (+2.5), company name mention (+2.5), self-introduction by name (+2.5), offer of assistance (+2.5).",10.0,"""May I have your name please? My name is Chatchai Intharak."" (+5 pts) (+5 pts)","The agent met 2 of 3 verification sub-criteria for contact verification: verified contact person name (+5), verified registered member / company name on account (+5), verified caller's relationship to the registered member not met (0).",0.0,No evidence found,"The agent did not review or update the address during the call, so this all-or-nothing criterion was not met (0).",10.0,"""May I confirm your current phone number ending in 7749?"" (+10 pts)","The agent reviewed/updated the phone number with the customer and obtained confirmation, so this criterion was fully met (+10). This category is all-or-nothing and qualifies in full when review or update occurs.",10.0,"""May I confirm your e-mail address is chatchai.i@ptt-corp.com?"" (+10 pts)","The agent reviewed/updated the email address with the customer and obtained confirmation, so this criterion was fully met (+10). This category is all-or-nothing and qualifies in full when review or update occurs.",20.0,"""I'm sorry to hear that you're considering leaving, may I ask what specifically has not met your expectations? Based on what you've shared, there is actually a lower-tier plan that may suit your usage better and could be a good alternative to full cancellation. If you would still like to proceed with cancellation, I can process that request and it will take effect at the end of your current billing cycle. You will receive a confirmation email once the cancellation has been finalized."" (+5 pts) (+5 pts) (+5 pts) (+5 pts)","The agent met all 4 information-giving sub-criteria for issue resolution: provided relevant account/issue information (+5), answered the customer's specific concern (+5), communicated next steps clearly (+5), gave a clear resolution (+5).",10.0,"""I understand you may also use our mobile application for reviewing your usage and plan options before deciding to cancel. That way, you could compare plans yourself and possibly find a better fit."" (+6 pts) (+1 pt) (+3 pts)","The agent met all 3 application-promotion sub-criteria for the application promotion: mentioned/recommended the mobile application (+6), recommendation relevant to customer's need (+1), explained a concrete benefit of the application (+3).",0.0,No evidence found,The agent did not meet the additional-request criterion for closing acknowledgement: offered additional assistance not met (0).,10.0,"""Thank you for calling Automaticine. Have a good day."" (+5 pts) (+5 pts)","The agent met both ending sub-criteria for the call ending: thanked the customer (+5), gave a professional closing statement (+5).",High,"The conversation involves membership cancellation request following dissatisfaction. Based on the nature of the issue, this maps to a High classification.","cancel, not getting enough value, disappointed, frustrated, membership cancellation request following dissatisfaction",membership cancellation request following dissatisfaction,-5.0,Frustrated,Frustrated,"I'll think about it, okay, fine","cancel, not getting enough value, disappointed, frustrated"
AMC-L-CC-016,James Jackson,"James Jackson: Good morning.\nJames Jackson: How may I assist you today?\nCustomer: I'm interested in upgrading my current plan to get more benefits, what options do I have?\nJames Jackson: May I have your name please?\nCustomer: My name is Somsak Charoen.\nJames Jackson: May I also confirm the name registered on this account?\nCustomer: Yes, it's under Somsak Charoen.\nJames Jackson: And may I confirm you are the account holder yourself?\nCustomer: Yes, this is my own account.\nJames Jackson: May I confirm your e-mail address is somsak.c@ymail.com?\nCustomer: Yes, that's the same.\nJames Jackson: Based on your current usage, I would recommend our Premium Plan which includes additional coverage and priority support.\nJames Jackson: To directly answer your question, yes, the upgrade can be applied immediately and will be reflected on your next billing cycle.\nJames Jackson: Your new plan benefits will be active starting from today.\nJames Jackson: I understand you may also use our mobile application for comparing all available plans side by side. That way, you can switch plans anytime without waiting on a call.\nJames Jackson: Is there anything else I can help you with today?\nCustomer: No, that's all, thank you.\nJames Jackson: Thank you for calling Automaticine.\nJames Jackson: Have a good day.",AMC-L-CC-01620260130084134856,70.0,5.0,"""Good morning. How may I assist you today?"" (+2.5 pts) (+2.5 pts)","The agent met 2 of 4 greeting sub-criteria for the greeting: professional greeting (+2.5), company name mention not met (0), self-introduction by name not met (0), offer of assistance (+2.5).",15.0,"""May I have your name please? My name is Somsak Charoen."" (+5 pts) (+5 pts) (+5 pts)","The agent met all 3 verification sub-criteria for contact verification: verified contact person name (+5), verified registered member / company name on account (+5), verified caller's relationship to the registered member (+5).",0.0,No evidence found,"The agent did not review or update the address during the call, so this all-or-nothing criterion was not met (0).",0.0,No evidence found,"The agent did not review or update the phone number during the call, so this all-or-nothing criterion was not met (0).",10.0,"""May I confirm your e-mail address is somsak.c@ymail.com?"" (+10 pts)","The agent reviewed/updated the email address with the customer and obtained confirmation, so this criterion was fully met (+10). This category is all-or-nothing and qualifies in full when review or update occurs.",15.0,"""Based on your current usage, I would recommend our Premium Plan which includes additional coverage and priority support. To directly answer your question, yes, the upgrade can be applied immediately and will be reflected on your next billing cycle. Your new plan benefits will be active starting from today."" (+5 pts) (+5 pts) (+5 pts)","The agent met 3 of 4 information-giving sub-criteria for issue resolution: provided relevant account/issue information (+5), answered the customer's specific concern (+5), communicated next steps clearly not met (0), gave a clear resolution (+5).",10.0,"""I understand you may also use our mobile application for comparing all available plans side by side. That way, you can switch plans anytime without waiting on a call."" (+6 pts) (+1 pt) (+3 pts)","The agent met all 3 application-promotion sub-criteria for the application promotion: mentioned/recommended the mobile application (+6), recommendation relevant to customer's need (+1), explained a concrete benefit of the application (+3).",5.0,"""Is there anything else I can help you with today?"" (+5 pts)",The agent met the additional-request criterion for closing acknowledgement: offered additional assistance (+5).,10.0,"""Thank you for calling Automaticine. Have a good day."" (+5 pts) (+5 pts)","The agent met both ending sub-criteria for the call ending: thanked the customer (+5), gave a professional closing statement (+5).",Normal,"The conversation involves plan upgrade inquiry. Based on the nature of the issue, this maps to a Normal classification.","awesome, thank you so much, sounds great, perfect, plan upgrade inquiry",plan upgrade inquiry,10.0,Happy,Happy,"awesome, thank you so much, sounds great, perfect",none noted
AMC-L-CC-002,Sarah Johnson,"Sarah Johnson: Good morning.\nSarah Johnson: Thank you for calling Automaticine.\nSarah Johnson: How may I assist you today?\nCustomer: I've been trying to log into the mobile app for two days and it keeps saying my password is incorrect.\nCustomer: I've already tried resetting it twice and it still doesn't work.\nSarah Johnson: May I have your name please?\nCustomer: My name is Ploypailin Watcharaporn.\nSarah Johnson: May I also confirm the name registered on this account?\nCustomer: Yes, it's under Ploypailin Watcharaporn.\nSarah Johnson: May I confirm your current address is 45 Ramana Rd., Min Buri, Bangkok 10510?\nCustomer: Yes, that is correct.\nSarah Johnson: May I confirm your current phone number ending in 1312?\nCustomer: Yes, that's right.\nSarah Johnson: May I confirm your e-mail address is ploypailin.w@outlook.com?\nCustomer: Yes, that's the same.\nSarah Johnson: I have checked your account and I can see two failed reset attempts logged on our side as well.\nSarah Johnson: This is likely caused by a temporary lock after multiple failed attempts, which is a known issue our technical team is aware of.\nSarah Johnson: I will send you a manual reset link to your registered email, which should work within the next 15 minutes.\nSarah Johnson: If the issue persists after that, I will escalate this directly to our technical team for a permanent fix.\nCustomer: I just hope this actually gets resolved this time.\nSarah Johnson: I understand you may also use our mobile application for resetting your password through an alternate verification method.\nSarah Johnson: Is there anything else I can help you with today?\nCustomer: No, that's all, thank you.",AMC-L-CC-00220260119083730514,79.5,7.5,"""Good morning. Thank you for calling Automaticine. How may I assist you today?"" (+2.5 pts) (+2.5 pts) (+2.5 pts)","The agent met 3 of 4 greeting sub-criteria for the greeting: professional greeting (+2.5), company name mention (+2.5), self-introduction by name not met (0), offer of assistance (+2.5).",10.0,"""May I have your name please? My name is Ploypailin Watcharaporn."" (+5 pts) (+5 pts)","The agent met 2 of 3 verification sub-criteria for contact verification: verified contact person name (+5), verified registered member / company name on account (+5), verified caller's relationship to the registered member not met (0).",10.0,"""May I confirm your current address is 45 Ramana Rd., Min Buri, Bangkok 10510?"" (+10 pts)","The agent reviewed/updated the address with the customer and obtained confirmation, so this criterion was fully met (+10). This category is all-or-nothing and qualifies in full when review or update occurs.",10.0,"""May I confirm your current phone number ending in 1312?"" (+10 pts)","The agent reviewed/updated the phone number with the customer and obtained confirmation, so this criterion was fully met (+10). This category is all-or-nothing and qualifies in full when review or update occurs.",10.0,"""May I confirm your e-mail address is ploypailin.w@outlook.com?"" (+10 pts)","The agent reviewed/updated the email address with the customer and obtained confirmation, so this criterion was fully met (+10). This category is all-or-nothing and qualifies in full when review or update occurs.",20.0,"""I have checked your account and I can see two failed reset attempts logged on our side as well. This is likely caused by a temporary lock after multiple failed attempts, which is a known issue our technical team is aware of. I will send you a manual reset link to your registered email, which should work within the next 15 minutes. If the issue persists after that, I will escalate this directly to our technical team for a permanent fix."" (+5 pts) (+5 pts) (+5 pts) (+5 pts)","The agent met all 4 information-giving sub-criteria for issue resolution: provided relevant account/issue information (+5), answered the customer's specific concern (+5), communicated next steps clearly (+5), gave a clear resolution (+5).",7.0,"""I understand you may also use our mobile application for resetting your password through an alternate verification method."" (+6 pts) (+1 pt)","The agent met 2 of 3 application-promotion sub-criteria for the application promotion: mentioned/recommended the mobile application (+6), recommendation relevant to customer's need (+1), explained a concrete benefit of the application not met (0).",5.0,"""Is there anything else I can help you with today?"" (+5 pts)",The agent met the additional-request criterion for closing acknowledgement: offered additional assistance (+5).,0.0,No evidence found,"The agent did not meet either of the 2 ending sub-criteria for the call ending: thanked the customer not met (0), gave a professional closing statement not met (0).",Exception,"The conversation involves mobile application login failure preventing self-service access. Based on the nature of the issue, this maps to an Exception classification.","frustrated, two days, still doesn't work, annoying, mobile application login failure preventing self-service access",mobile application login failure preventing self-service access,-5.0,Frustrated,Frustrated,"okay, let's try, appreciate the help","frustrated, two days, still doesn't work, annoying"
